{
  "$schema": "http://json-schema.org/draft-07/schema#",
  "title": "helm-os config",
  "description": "Your configuration. Supplies every user-specific value the framework reads (schedule, connectors, projects, voice). Lives in your vault as os.config.json; the framework repo ships none of it.",
  "type": "object",
  "required": [
    "identity",
    "schedule",
    "paths",
    "connectors",
    "projects"
  ],
  "additionalProperties": true,
  "properties": {
    "identity": {
      "type": "object",
      "required": [
        "name",
        "timezone"
      ],
      "properties": {
        "name": {
          "type": "string",
          "description": "The principal the OS works for."
        },
        "role": {
          "type": "string",
          "description": "Job/role; steers the routine preset and vocabulary."
        },
        "timezone": {
          "type": "string",
          "description": "IANA tz, e.g. Asia/Manila. The clock stage reads this."
        },
        "briefAddressee": {
          "type": "string",
          "description": "Who the brief is written to (usually the principal)."
        },
        "org": {
          "type": "string",
          "description": "The team or company name the brief uses when a client is waiting on the team."
        },
        "teamDomain": {
          "type": "string",
          "description": "The team's email domain, e.g. example.com. A reply from this domain clears a client ball."
        }
      }
    },
    "schedule": {
      "type": "object",
      "required": [
        "slots"
      ],
      "properties": {
        "slots": {
          "type": "object",
          "description": "Hour (local, 0-23 as string) to mode. Modes: morning, capture, evening.",
          "additionalProperties": {
            "enum": [
              "morning",
              "capture",
              "evening"
            ]
          }
        },
        "cron": {
          "type": "string",
          "description": "Cron the adapter registers the routine with."
        },
        "quietDays": {
          "type": "array",
          "items": {
            "type": "integer",
            "minimum": 0,
            "maximum": 6
          },
          "description": "Weekdays to skip (0=Sun)."
        }
      }
    },
    "paths": {
      "type": "object",
      "required": [
        "vaultRoot"
      ],
      "properties": {
        "vaultRoot": {
          "type": "string",
          "description": "Absolute path to the user's vault. The only absolute path; everything else is resolved relative to it by helm/lib/paths.js."
        }
      }
    },
    "voice": {
      "type": "object",
      "properties": {
        "profile": {
          "type": "string",
          "description": "Vault-relative path to the voice profile (default Personal/profile.md)."
        }
      }
    },
    "connectors": {
      "type": "object",
      "description": "Which tools this user has. Absent connectors are simply skipped by the sweeps.",
      "properties": {
        "email": {
          "type": "string",
          "description": "Email connector id/name."
        },
        "calendar": {
          "type": "string"
        },
        "chatSurfaces": {
          "type": "array",
          "description": "Chat channels to sweep.",
          "items": {
            "type": "object",
            "required": [
              "type",
              "id"
            ],
            "properties": {
              "type": {
                "type": "string",
                "description": "telegram | whatsapp | discord | slack | teams | gchat | imessage"
              },
              "id": {
                "type": "string",
                "description": "Channel/space/chat id or handle."
              },
              "label": {
                "type": "string"
              }
            }
          }
        },
        "meetingSources": {
          "type": "array",
          "items": {
            "type": "string"
          },
          "description": "e.g. tactiq, readai, pocket."
        },
        "ticketBoards": {
          "type": "array",
          "items": {
            "type": "object",
            "required": [
              "connector"
            ],
            "properties": {
              "connector": {
                "type": "string",
                "description": "e.g. atlassian, jira, wrike, linear."
              },
              "cloudId": {
                "type": "string"
              },
              "projectKeys": {
                "type": "array",
                "items": {
                  "type": "string"
                }
              },
              "readVia": {
                "type": "string",
                "enum": [
                  "mcp",
                  "browser"
                ],
                "description": "browser when the MCP cannot see this board (wrong account, no connector)."
              },
              "browserUrl": {
                "type": "string",
                "description": "The board's inbox/notifications URL, read in the logged-in browser when readVia is browser."
              },
              "note": {
                "type": "string",
                "description": "Why this board reads the way it does, shown to the sweep."
              }
            }
          }
        },
        "projectAliasPattern": {
          "type": "string",
          "description": "Shared per-project mailbox pattern, e.g. <project>@example.com. Mail there counts as client venue."
        }
      }
    },
    "identityIds": {
      "type": "object",
      "description": "The user's own ids per connector, used to tell self from others (e.g. Discord authorId/guildId).",
      "additionalProperties": true
    },
    "projects": {
      "type": "array",
      "description": "The project-map. Each row is a project/mission the generic project-runner and portfolio-health drive.",
      "items": {
        "type": "object",
        "required": [
          "key"
        ],
        "properties": {
          "key": {
            "type": "string",
            "description": "Join key, stable, never renamed."
          },
          "label": {
            "type": "string"
          },
          "type": {
            "enum": [
              "product-project",
              "fixed-cost",
              "partnership",
              "account-watch",
              "delivery"
            ]
          },
          "state": {
            "enum": [
              "active",
              "sales",
              "maintenance",
              "paused",
              "closed"
            ]
          },
          "floor": {
            "type": "integer",
            "description": "Weekdays of silence before a sweep fires anyway. Overrides the state default."
          },
          "channels": {
            "type": "array",
            "items": {
              "type": "string"
            },
            "description": "Surfaces the project owns; free text or connector refs."
          },
          "ledgerTag": {
            "type": "string",
            "description": "Source tag written into the shared follow-ups ledger."
          },
          "statusFile": {
            "type": "string",
            "description": "Vault-relative status.md path."
          },
          "bespoke": {
            "type": "string",
            "description": "Optional path to a file project that overrides the generic runner."
          },
          "agentType": {
            "type": "string",
            "description": "Optional: a harness subagent type to run this project instead of the generic runner (preserves a hand-tuned project agent)."
          }
        }
      }
    },
    "areas": {
      "type": "array",
      "description": "Brief taxonomy: how work is grouped and labeled in the composed brief.",
      "items": {
        "type": "object",
        "required": [
          "name"
        ],
        "properties": {
          "name": {
            "type": "string"
          },
          "emoji": {
            "type": "string"
          }
        }
      }
    },
    "careRanking": {
      "type": "array",
      "items": {
        "type": "string"
      },
      "description": "Priority hierarchy the audio brief weights by, most important first."
    },
    "gates": {
      "type": "object",
      "properties": {
        "ledgerEnforce": {
          "type": "boolean",
          "description": "false = write-ledger shadow mode, true = block duplicates."
        },
        "deslop": {
          "type": "boolean"
        }
      }
    },
    "audio": {
      "type": "object",
      "description": "Audio brief. Needs a Gemini API key in your environment (GEMINI_TTS_KEY or GEMINI_API_KEY); the OS never takes the key value, only reads it from the environment.",
      "properties": {
        "enabled": {
          "type": "boolean",
          "description": "Turn the spoken brief on."
        },
        "voice": {
          "type": "string",
          "description": "Gemini TTS voice (male: Charon, Puck, Fenrir, Enceladus)."
        },
        "playerArtifactUrl": {
          "type": "string",
          "description": "Standing player URL to republish in place; leave empty to mint a new one each run."
        }
      }
    },
    "writes": {
      "type": "object",
      "description": "How the OS writes to external systems. Email and chat are always draft-only. This controls trackers.",
      "properties": {
        "tracker": {
          "enum": [
            "draft",
            "auto"
          ],
          "description": "draft (default): the OS drafts proposed ticket comments/creates into the project's drafts/ for you to apply. auto: it writes them directly in your voice, gated by the write-ledger."
        }
      }
    },
    "usage": {
      "type": "object",
      "description": "Usage routine: how you work with AI, read from your Claude Code and Codex transcripts. Numbers go to _usage/, anything built from your words stays in _usage/local.nosync/.",
      "properties": {
        "enabled": {
          "type": "boolean",
          "description": "Schedule the nightly rollup. Default true."
        },
        "model": {
          "type": "boolean",
          "description": "Allow the small model calls (one-time labeling, nightly 3-line read). false = zero tokens, numbers only."
        },
        "osPrefixes": {
          "type": "array",
          "items": {
            "type": "string"
          },
          "description": "Opening words of prompts your automation writes, so they count as the OS and not you."
        },
        "ownerName": {
          "type": "string",
          "description": "Your name as your automation writes it. Defaults to identity.name."
        },
        "particles": {
          "type": "array",
          "items": {
            "type": "string"
          },
          "description": "Filler words or particles to count, e.g. from a second language."
        },
        "languages": {
          "type": "object",
          "additionalProperties": {
            "type": "array",
            "items": {
              "type": "string"
            }
          },
          "description": "Language name -> word list, for the share of each language in your messages."
        },
        "projectPaths": {
          "type": "object",
          "additionalProperties": {
            "type": "string"
          },
          "description": "Folder prefix -> project label."
        },
        "projectAliases": {
          "type": "object",
          "additionalProperties": {
            "type": "array",
            "items": {
              "type": "string"
            }
          },
          "description": "Project label -> names you type for it."
        },
        "hubPaths": {
          "type": "array",
          "items": {
            "type": "string"
          },
          "description": "Folders where you work on many projects; sessions there take the project their messages name. The vault is always one."
        },
        "aliases": {
          "type": "object",
          "additionalProperties": {
            "type": "array",
            "items": {
              "type": "string"
            }
          },
          "description": "Person name -> other names for them, on top of the people file."
        },
        "peopleFile": {
          "type": "string",
          "description": "People file, relative to the vault. Default People/people.md."
        },
        "prices": {
          "type": "object",
          "description": "Model id prefix -> { in, out, cacheRead?, cacheWrite? } in USD per million tokens, for models without a built-in price."
        },
        "codexModel": {
          "type": "string",
          "description": "Model for Codex labeling calls, when your default needs a newer CLI."
        },
        "timezone": {
          "type": "string"
        },
        "port": {
          "type": "number",
          "description": "Local dashboard port. Default 4747."
        }
      }
    }
  }
}
