{
  "identity": {
    "name": "Sam Cole",
    "role": "Founder / COO",
    "timezone": "America/New_York",
    "briefAddressee": "Sam"
  },
  "schedule": {
    "slots": {
      "7": "morning",
      "12": "capture",
      "19": "evening"
    },
    "cron": "45 7,12,19 * * 1-5",
    "quietDays": [
      0,
      6
    ]
  },
  "paths": {
    "vaultRoot": "/path/to/Your Name OS"
  },
  "voice": {
    "profile": "Personal/profile.md"
  },
  "connectors": {
    "email": "gmail",
    "calendar": "google-calendar",
    "chatSurfaces": [
      {
        "type": "slack",
        "id": "C-TEAM",
        "label": "team"
      },
      {
        "type": "whatsapp",
        "id": "wa",
        "label": "clients"
      }
    ],
    "meetingSources": [
      "tactiq",
      "pocket"
    ],
    "ticketBoards": [
      {
        "connector": "jira",
        "cloudId": "your-cloud-id",
        "projectKeys": [
          "OPS"
        ]
      }
    ]
  },
  "projects": [
    {
      "key": "client-a",
      "label": "Client A",
      "type": "delivery",
      "state": "active",
      "floor": 2,
      "channels": [
        "slack:C-TEAM",
        "jira:OPS"
      ],
      "ledgerTag": "CA",
      "statusFile": "Work/Client A/status.md"
    },
    {
      "key": "internal",
      "label": "Internal",
      "type": "account-watch",
      "state": "active",
      "floor": 3,
      "channels": [
        "slack:C-TEAM"
      ],
      "ledgerTag": "INT",
      "statusFile": "Work/Internal/status.md"
    }
  ],
  "areas": [
    {
      "name": "Client A",
      "emoji": "\ud83e\udd1d"
    },
    {
      "name": "Internal",
      "emoji": "\ud83c\udfe0"
    },
    {
      "name": "Sales",
      "emoji": "\ud83d\udcc8"
    },
    {
      "name": "Finance",
      "emoji": "\ud83d\udcb0"
    }
  ],
  "careRanking": [
    "delivery",
    "sales",
    "team",
    "finance"
  ],
  "writes": {
    "tracker": "draft"
  },
  "audio": {
    "enabled": false,
    "voice": "Charon",
    "playerArtifactUrl": ""
  }
}
