{
  "identity": {
    "name": "Alex Rivera",
    "role": "Head of Delivery",
    "timezone": "America/New_York",
    "briefAddressee": "Alex",
    "org": "Northwind",
    "teamDomain": "northwind.example"
  },
  "schedule": {
    "slots": {
      "7": "morning",
      "11": "capture",
      "14": "capture",
      "16": "capture",
      "19": "evening"
    },
    "cron": "45 7,11,14,16,19 * * 1-5",
    "quietDays": [
      0,
      6
    ]
  },
  "paths": {
    "vaultRoot": "/Users/alex/vault"
  },
  "voice": {
    "profile": "Personal/profile.md"
  },
  "connectors": {
    "email": "gmail",
    "calendar": "google-calendar",
    "chatSurfaces": [
      {
        "type": "slack",
        "id": "C0123ABC",
        "label": "delivery-team"
      },
      {
        "type": "discord",
        "id": "0000000000",
        "label": "project-x"
      }
    ],
    "meetingSources": [
      "tactiq",
      "pocket"
    ],
    "ticketBoards": [
      {
        "connector": "linear",
        "projectKeys": [
          "WEB",
          "API"
        ]
      },
      {
        "connector": "jira",
        "cloudId": "your-cloud-id",
        "projectKeys": [
          "OPS"
        ]
      },
      {
        "connector": "wrike",
        "projectKeys": [
          "CLIENT-X"
        ],
        "readVia": "browser",
        "browserUrl": "https://www.wrike.com/workspace.htm?acc=0000000#path=inbox",
        "note": "the Wrike MCP is signed in to a different account"
      }
    ],
    "projectAliasPattern": "<project>@northwind.example"
  },
  "identityIds": {
    "discord": {
      "authorId": "0000000000",
      "guildId": "1111111111"
    }
  },
  "projects": [
    {
      "key": "project-x",
      "label": "Project X",
      "type": "delivery",
      "state": "active",
      "floor": 2,
      "channels": [
        "slack:C0123ABC",
        "linear:WEB"
      ],
      "ledgerTag": "PX",
      "statusFile": "Work/Project X/status.md"
    }
  ],
  "areas": [
    {
      "name": "Project X",
      "emoji": "\ud83d\ude80"
    },
    {
      "name": "Sales",
      "emoji": "\ud83d\udcc8"
    }
  ],
  "careRanking": [
    "delivery",
    "sales",
    "team",
    "admin"
  ],
  "gates": {
    "ledgerEnforce": false,
    "deslop": true
  },
  "audio": {
    "enabled": false,
    "voice": "Charon",
    "playerArtifactUrl": ""
  },
  "usage": {
    "enabled": true,
    "model": true,
    "osPrefixes": [],
    "particles": [],
    "languages": {},
    "projectPaths": {},
    "projectAliases": {},
    "aliases": {}
  }
}
